{
  "contract": 1,
  "name": "Authored fighter",
  "rig": "fighter",
  "parts": {
    "pelvis": "characters/fighter/parts/pelvis.svg",
    "leg_upper_r": "characters/fighter/parts/leg_upper_r.svg",
    "leg_lower_r": "characters/fighter/parts/leg_lower_r.svg",
    "leg_upper_l": "characters/fighter/parts/leg_upper_l.svg",
    "leg_lower_l": "characters/fighter/parts/leg_lower_l.svg",
    "torso": "characters/fighter/parts/torso.svg",
    "arm_upper_r": "characters/fighter/parts/arm_upper_r.svg",
    "arm_lower_r": "characters/fighter/parts/arm_lower_r.svg",
    "arm_upper_l": "characters/fighter/parts/arm_upper_l.svg",
    "arm_lower_l": "characters/fighter/parts/arm_lower_l.svg",
    "head": "characters/fighter/parts/head.svg"
  },
  "cosmetics": [
    "cosmetics/royal-guard/hood.svg",
    "cosmetics/royal-guard/pauldron.svg",
    "cosmetics/royal-guard/skirt.svg"
  ]
}
