{
  "contract": 1,
  "name": "Kiran",
  "rig": "fighter",
  "parts": {
    "pelvis": "characters/kiran/parts/pelvis.svg",
    "leg_upper_r": "characters/kiran/parts/leg_upper_r.svg",
    "leg_lower_r": "characters/kiran/parts/leg_lower_r.svg",
    "leg_upper_l": "characters/kiran/parts/leg_upper_l.svg",
    "leg_lower_l": "characters/kiran/parts/leg_lower_l.svg",
    "torso": "characters/kiran/parts/torso.svg",
    "arm_upper_r": "characters/kiran/parts/arm_upper_r.svg",
    "arm_lower_r": "characters/kiran/parts/arm_lower_r.svg",
    "arm_upper_l": "characters/kiran/parts/arm_upper_l.svg",
    "arm_lower_l": "characters/kiran/parts/arm_lower_l.svg",
    "head": "characters/kiran/parts/head.svg"
  },
  "cosmetics": []
}
